url,meta_title,meta_description
https://seordp.net/serpstat,Serpstat Group Buy – Full Access | SEORDP,Get Quillbot group buy at low price 2$ per month. Get Instant Access. Quillbot group buy. Best group buy website Get started at seordp.net.
https://seordp.net/storyblocks,Storyblocks Group Buy – Cheap Premium Access | SEORDP,"Helium10 group buy is a tool designed for sellers on Amazon who need help with SEO, product research, competitor analysis, and more. Get started at seordp.net."
https://seordp.net/spyfu,Spyfu Group Buy – Save on Premium Tools | SEORDP,Get SpyFu group buy at low price 4$ per month. Get Instant Access. Spyfu group buy. Best group buy website Get started at seordp.net.
https://seordp.net/spamzilla,Spamzilla Group Buy – Best Price | SEORDP,Get Stock Unlimited group buy at low price 3$ per month. Get Instant Access. Stockunlimited group buy. Best group buy website Get started at seordp.net.
https://seordp.net/skills-share,Skills Share Group Buy – Affordable Pro Access | SEORDP,Get Rytr group buy at low price 5$ per month. Get Instant Access. Rytr group buy. Best group buy website Get started at seordp.net.
https://seordp.net/seo-profiler,SEO Profiler Group Buy – at Low Price | SEORDP,Copymatic is a powerful AI-powered copywriter tools and you can get this tool with group buy at cheap price at just 6$. Get started at seordp.net.
https://seordp.net/semrush,SEMrush Group Buy – SEO Suite & Site Audit | SEORDP,Get Storyblocks group buy at low price 4$ per month. Get Instant Access. Storyblocks group buy. Best group buy website Get started at seordp.net.
https://seordp.net/sellthetrend,Sellthetrend Group Buy – Cheap Premium Access | SEORDP,Get Wordhero Unlimited with Long-form editor at low price 5$ per month. Wordhero unlimited with Long-form editor group buy Get started at seordp.net.
https://seordp.net/salehoo,Salehoo Group Buy – Save on Premium Tools | SEORDP,Get Quetext group buy at low price 2$ per month. Get Instant Access. Quetext group buy. Best group buy website Get started at seordp.net.
https://seordp.net/quillbot,Quillbot Group Buy – Best Price | SEORDP,Get Lovepik group buy at low price 3$ per month. Get Instant Access. Lovepik group buy. Best group buy website Get started at seordp.net.
https://seordp.net/pillbanana,Pillbanana Group Buy – Affordable Pro Access | SEORDP,Get Wordtune group buy at low price 3$ per month. Get Instant Access. Wordtune group buy. Best group buy website Get started at seordp.net.
https://seordp.net/pexda,Pexda Group Buy – Best Price | SEORDP,Get Indexification group buy at low price 2$ per month. Get Instant Access. Indexification group buy. Best group buy website Get started at seordp.net.
https://seordp.net/netflix,Netflix Group Buy – Full Access | SEORDP,Get Placeit group buy at low price 1$ per month. Get Instant Access. Placeit group buy. Best group buy website Get started at seordp.net.
https://seordp.net/moz,Moz Group Buy – Site Audit & Link Research | SEORDP,Get Iconscout group buy at low price 4$ per month. Get Instant Access. Iconscout group buy. Best group buy website Get started at seordp.net.
https://seordp.net/majestic,Majestic Group Buy – Premium Full Access,Get WriterZen group buy at low price 3$ per month. Get Instant Access. WriterZen group buy. Best group buy website Get started at seordp.net.
https://seordp.net/kwfinder,Kwfinder Group Buy – Pro Low Price | Group Buy SEO Tools,Get Wordai Unlimited Groupbuy at low price 3$ per month. Wordai unlimited generation groupbuy at low price Get started at seordp.net.
https://seordp.net/keywordtool-io,Keywordtool IO Group Buy – Full Access | Pro,Get Moz Pro group buy at low price 2$ per month. Get Instant Access. Moz Pro group buy. Best group buy website Get started at seordp.net.
https://seordp.net/jungle-scout,Jungle Scout Group Buy – Affordable Premium,"SEMrush vs Ahrefs: which SEO tool is better for your needs? Compare features, pricing, and value. Start ranking smarter today. Get started at seordp.net."
https://seordp.net/jasper,Jasper Group Buy – Low Price | seordp | Group Buy SEO Tools,"Learn what is SEMrush Pro, its features, pricing, use cases, and whether it's right for beginners, PPC research, and long-term SEO growth.!! Get started at seordp..."
https://seordp.net/ispionage,Ispionage Group Buy – Unlimited Cheap | Group Buy SEO Tools,"Learn how to use Google Veo 3 without API or technical setup to create cinematic AI videos for YouTube, storytelling, and creative workflows. Get started at seord..."
https://seordp.net/indexification,Indexification Group Buy – Premium Pro Plan,"Compare Google Veo 3 Fast vs Standard to choose the right mode for speed, quality, and YouTube content creation workflows and results. Get started at seordp.net."
https://seordp.net/helium10,Helium10 Group Buy – Best Price Full Access,"Learn how to create YouTube videos using Google Veo 3 with AI visuals, smart prompts, editing workflows and YouTube-ready best practices. Get started at seordp.net."
https://seordp.net/grammarly,Grammarly Group Buy – Pro Premium Access,"Google Veo 3 pricing depends on how and where you access it. There is no single flat price. Instead, Google Veo 3 is available through Google AI subscription Get ..."
https://seordp.net/freepik,Freepik Group Buy – Full Access at Best Price,"If you are using CapCut and searching for how to download CapCut video without Pro, you are not alone. Thousands of creators, beginners, and freelancers want Get ..."
https://seordp.net/envato-elements,Envato Elements Group Buy – Cheap Best Price,"Discover what’s better than CapCut and explore top alternatives like DaVinci Resolve, Filmora, VEED.IO, and more to upgrade your editing skills. Get started at se..."
https://seordp.net/ecomhunt,Ecomhunt Group Buy – Low Cost | seordp | Group Buy SEO Tools,"Can you do SEO with AI? Learn how AI tools boost research, content creation, and improve strategy while keeping human expertise essential. Get started at seordp.net."
https://seordp.net/combo-seo-tools-standard-plan,Combo SEO Tools Standard Plan Group Buy – Premium Instant,"Discover the best tool to create videos in 2025, including CapCut Pro, ElevenLabs AI, Veo 3, and Adobe Premiere — available on SEORDP."
https://seordp.net/combo-seo-tools-lite-plan,Combo SEO Tools Lite Plan Group Buy – Pro Unlimited Access,"Remember that time you spent hours researching something online, only to find yourself buried in irrelevant search results? Frustrating, right? Well, that's Get s..."
https://seordp.net/chatgpt,Chatgpt Group Buy – Best Value Low Price,"Remember that time you spent hours reaching out to influencers, only to get radio silence? It's a frustrating situation many marketers face. Luckily, tools Get st..."
https://seordp.net/cbengine,Cbengine Group Buy – Full Premium Access,"Ever feel like you're staring into a content abyss, unsure of what your audience actually wants to read? You're not alone! Many content creators struggle to Get s..."
https://seordp.net/canva,Canva Group Buy – Affordable Best Price | Group Buy SEO,"Remember that time you spent hours creating the perfect website, only to find crickets chirping when it came to traffic? It's a frustrating situation that Get sta..."
https://seordp.net/buzzsumo,Buzzsumo Group Buy – Content Research & Backlinks | SEORDP,"Remember that time you spent hours creating the perfect blog post, only to be met with crickets? You poured your heart and soul into the content, but nobody Get s..."
https://seordp.net/buzzstream,Buzzstream Group Buy – Save on Premium Tools | SEORDP,"Ever felt lost in the digital jungle, battling competitors you can't quite size up? Imagine you're selling handmade jewelry online, and suddenly, your top Get sta..."
https://seordp.net/article-forge,Article Forge Group Buy – Best Price | SEORDP,"Ever feel lost in the SEO maze, unsure how to make your website shine? Picture this: you've poured your heart into creating amazing content, but nobody seems Get ..."
https://seordp.net/article-builder,Article Builder Group Buy – Cheap Access | SEORDP,"Remember that time you spent hours optimizing your website, only to see your competitors rank higher? Frustrating, right? It's a common experience, but the Get st..."
https://seordp.net/surfer-seo,Surfer SEO Group Buy – Content Optimization | SEORDP,"Picture this: You're launching a new website, brimming with great content, but crickets. No traffic, no clicks, nothing. You’ve put in the work, but where are Get..."
https://seordp.net/ubersuggest,Ubersuggest Group Buy – Full Access | SEORDP,"Remember that time you spent hours crafting the perfect blog post, only to see it languish on page five of Google? Frustrating, right? You're not alone. Many Get ..."
https://seordp.net/runwayml,Runwayml Group Buy – Cheap Premium Access | SEORDP,"Imagine you're building a LEGO castle. You put all the bricks together, but the roof keeps falling off. Frustrating, right? That's how it feels when your Get star..."
https://seordp.net/notion,Notion Group Buy – Workspace & Docs at Best Price | SEORDP,"Imagine you're trying to build the coolest treehouse on the block. You need strong materials, right? Well, in the online world, your website is like that Get star..."
https://seordp.net/spotify,Spotify Group Buy – Best Price | SEORDP,"Imagine you're baking a cake. You follow the recipe (your content), but somehow, it doesn't rise right (your website isn't ranking). That's where a tool comes Get..."
https://seordp.net/mailchimp,Mailchimp Group Buy – Affordable Pro Access | SEORDP,"Remember the last time you searched for something online? Maybe you wanted to find the best pizza place near you, or perhaps you were looking up how to bake a Get..."
https://seordp.net/hootsuite,Hootsuite Group Buy – at Low Price | SEORDP,"Remember that time you spent hours trying to figure out why your website wasn't showing up on Google? Frustrating, right? You're not alone. Many businesses Get st..."
https://seordp.net/figma,Figma Group Buy – Design & Prototyping | SEORDP,"Remember that time you tried to find the perfect pizza place online, and the top results were all for places miles away? Frustrating, right? That's the impact Get..."
https://seordp.net/hubspot,HubSpot Group Buy – CRM & Marketing Tools at Low Cost | SEORDP,"The INI to YAML Converter by SEORDP is a smart, online utility that transforms configuration files from the classic INI format into the modern"
https://seordp.net/midjourney,Midjourney Group Buy – AI Art & Images | SEORDP,"Learn how to convert website visitors using Garage2Global’s advanced strategies in UX, SEO, behavioral targeting, and CRO. Perfect for startups, marketers, and bu..."
https://seordp.net/leonardo-ai,Leonardo AI Group Buy – Best Price | SEORDP,"In a world where content creation demands personality, diversity, and emotional depth, the ability to switch between two distinct AI voices in one script is Get s..."
https://seordp.net/coursera-plus,Coursera PLUS Group Buy – Affordable Pro Access | SEORDP,"If you're looking for powerful, user-friendly, or budget-friendly ElevenLabs alternatives, you're in the right place. Below, I’ll break down 7 trusted tools Get s..."
https://seordp.net/udemy,Udemy Group Buy – Premium at Best Price | Group Buy SEO,"Discover why content creators and experts are calling ElevenLabs AI the best text-to-speech AI available today. A comprehensive review by Mr. Isloo, founder of SE..."
https://seordp.net/turnitin,Turnitin Group Buy – Low Price Unlimited,"In the rapidly changing world of search engine optimization (SEO), mastering keyword research is essential. As we near 2024, the leading keyword Get started at se..."
https://seordp.net/wordhero,Wordhero Group Buy – Pro Full Access | Group Buy SEO Tools,Plot Size Calculator Get started at seordp.net.
https://seordp.net/scribd,Scribd Group Buy – Cheap Unlimited Access,"If you're a student diving into the world of graphic design or just looking to polish your skills, choosing the right tools can significantly enhance your Get sta..."
https://seordp.net/prezi,Prezi Group Buy – Presentation Software at 90% OFF | SEORDP,"In today’s digital age, having the right tools can significantly enhance your productivity and creativity, whether you’re dealing with SEO, graphic design, Get st..."
https://seordp.net/epidemic-sound,Epidemic Sound Group Buy – Full Low Cost,Are you a digital marketer looking to dip your toes into the world of SEO but don't know where to start? You're not alone. With an overwhelming amount of Get star...