url,meta_title,meta_description
https://seordp.net,"Best Group Buy SEO Tools 2025 - Ahrefs, SEMrush, Moz Pro at 90% OFF","Access 50+ premium SEO tools at 90% discount. Get Ahrefs, SEMrush, Moz Pro, ChatGPT Plus, Canva Pro & more. Join 45,000+ users."
https://seordp.net/blog,Blog | Group Buy SEO Tools – Best Price at Low Cost,"SEORDP Best Group buy seo tools Provider, Check out the best group buy SEO tools provider, We offer some of the best prices on the market"
https://seordp.net/products,Products | Group Buy SEO Tools – Best Price,Looking for a great deal on SEO tools? Look no further than Rytr.me's unlimited group buy! Rytr.me Unlimited Group buy | SEO tools by SEORDP
https://seordp.net/pages,Pages | Group Buy SEO Tools – Best Price,"Frase.io Group Buy, Frase.io Group Buy | SEO Tools | The Best AI Writer on the Market | Group Buy SEO Tools, Frase.io cheap at SEORDP"
https://seordp.net/single-tools-list,Complete Tools List - 50+ SEO & AI Tools at 90% OFF | SEORDP,"Browse 50+ premium SEO tools in one place: Ahrefs, SEMrush, Moz Pro, Canva Pro & more at 90% discount. Get instant access at SEORDP."
https://seordp.net/contact-us,Contact Us | Group Buy SEO Tools – Best Price,"ChatGPT Premium Group buy | Unlimited Access | 4$ month @ ChatGPT Group buy, ChatGPT is an artificial intelligence chatbot, SEORDP"
https://seordp.net/editorial-guidelines,Editorial Guidelines | Group Buy SEO Tools,Get Storyblocks group buy at low price 3$ per month. Get Instant Access. Storyblocks group buy. Best group buy website. Storyblocks Get started at seor...
https://seordp.net/about-us,About Us | Group Buy SEO Tools – Best Price,VidIQ Group Buy is an add-on and extension tool created by expert strategists with many years of experience in the online video platform. Get started at seordp.net.
https://seordp.net/terms-of-service,Terms Of Service | Group Buy SEO Tools – Best Price,"WordHero group buy is the #1 AI writing software tool for business owners, marketers, and writers. Wordhero group buy starting just $1 per day. Get started at seo..."
https://seordp.net/privacy-policy,Privacy Policy | Group Buy SEO Tools – Best Price,Pictory Group Buy | Pictory uses AI to easily convert long-form video and text content into short branded videos for social media. Group Buy Tools Get started at ...
https://seordp.net/designer-plan,Designer Plan Group Buy – Full Features at Low Price,Nichesss Group buy at Cheap Prices. Nichesss is an Ai writer that creates SEO-friendly content for blog. Unlimited Niches$$ Group buy Get started at seordp.net.
https://seordp.net/cart,Cart | Group Buy SEO Tools – Best Price at Low Cost,Texta.ai Group buy at Cheap Prices. Texta.ai is an Ai writer that creates SEO-friendly content for blog. Texta.ai Features in Plan. Unlimited Access Get started a...
https://seordp.net/refund-returns,Refund Returns | Group Buy SEO Tools – Best Price,Writersonic Group buy at Cheap Prices. Writersonic is an Ai writer that creates SEO-friendly content for blog. Writersonic Features in Plan. Get started at seordp...
https://seordp.net/return-and-refund-policy,Return And Refund Policy | Group Buy SEO Tools,"Copygenius Group Buy, Best High-Quality Content Generator, CopyGenius Group Buy are the perfect tools to help you create the best content. Get started at seordp.net."
https://seordp.net/pricing-plans,Pricing Plans – 60+ SEO Tools at Low Cost | SEORDP,Get Wordtune group buy at low price 1$ per month. Get Instant Access. Wordtune group buy. Best group buy website Get started at seordp.net.
https://seordp.net/seo-tools-list,SEO Tools List 2025 – Top Premium Tools Cheap | SEORDP,"WordHero group buy is the #1 AI writing software tool for business owners, marketers, and writers. Wordhero group buy starting just $1 per day. Get started at seo..."
https://seordp.net/seo-tools-list-2025,SEO Tools List 2025 – Top Premium Tools Cheap | SEORDP,"Browse 100+ premium SEO tools. Get Ahrefs, SEMrush, Moz at low cost."
https://seordp.net/introduction-to-group-buy-seo-tools,Introduction To Group Buy SEO Tools Group Buy – Cheap Price,wordai group buy is a tool to spin a paragraph or sentence to help you save time when you write content. Wordai Group buy Get started at seordp.net.
https://seordp.net/dmca-policy,DMCA Policy | Group Buy SEO Tools – Best Price,"Invideo Yearly Cheap - Stop spending thousands on video creation. Boost your video marketing with our easy-to-use, time-saving, Invideo Group Buy Get started at s..."
https://seordp.net/get-support,Get Support | Group Buy SEO Tools – Best Price,"Keywordtool.io Group Buy helps you determine the number of monthly searches globally, worldwide, and it also offers you many related keywords. Get started at ..."
https://seordp.net/combo-seo-tools-small,Combo SEO Tools Small Group Buy – Premium SEO Tool Access,"Closercopy Group Buy creates most Profitable Sales Copy Of All-Time Reverse-Engineered Into Artificial Intelligence, Closercopy Group Buy Get started at seordp.net."
https://seordp.net/ahrefs,Ahrefs Group Buy – Backlinks & Keyword Research | SEORDP,"Buzzsumo group buy provides the cheapest quality SEO tool in the world, we are committed to SEO tools at all times. Only $ 4.95 / month. Get started at seordp.net."
https://seordp.net/combo-seo-tools-ecom-plan,Combo SEO Tools Ecom Plan Group Buy – Ecom & Seller Pack | SEORDP,"Articlebuilder - Cheap Group Buy Seo Tools Provider, Articlebuilder is a group buy SEO tools that helps you rank higher in the search engines 😃 Get started at seo..."
https://seordp.net/combo-mega-pack-tools,Combo Mega Pack Tools Group Buy – Mega Bundle Access | SEORDP,Get Indexification group buy at low price 2$ per month. Get Instant Access. Indexification group buy. Best group buy website Get started at seordp.net.
https://seordp.net/combo-seo-tools-basic-plan,Combo Basic Plan Group Buy – Bundle Access | SEORDP,Udemy unlimited business account buy at cheap price just for 4$ per month. Watch unlimited content on Udemy at affordable cost. Udemy GRoup buy Get started at seo...
https://seordp.net/cheapest-group-buy-seo-tools-provide-100-premium-tools,Cheapest Group Buy – 100+ Premium SEO Tools at 90% OFF | SEORDP,Get Moz Pro group buy at low price 2$ per month. Get Instant Access. Moz Pro group buy. Best group buy website Get started at seordp.net.
https://seordp.net/shop,Shop | Group Buy SEO Tools – Best Price at Low Cost,"Copymatic Group Buy | SEORDP, Get a Copymatic group buy and get the tools you need to succeed! Join the group buy to get a discount on copymatic.ai premium"
https://seordp.net/terms-and-conditions,Terms and Conditions – Your Rights & Agreement | SEORDP,Get Quillbot group buy at low price 1.49$ per month. Get Instant Access. Quillbot group buy. Best group buy website. SEORDP
https://seordp.net/single-seo-tools,Single SEO Tools – Individual Tool Pricing at 90% OFF | SEORDP,"Browse 50+ premium SEO tools: Ahrefs, SEMrush, Moz Pro, Canva Pro at 90% discount. Get instant access at SEORDP."
https://seordp.net/ai-seo-tools,AI SEO Tools Group Buy – 50+ AI Tools Bundle | SEORDP,"There are a lot of SEO tools out there that can help improve your website’s visibility on the internet. However, many of these tools can be quite expensive. Get s..."
https://seordp.net/affordable-ahrefs-group-buy-boost-your-seo-strategy,Affordable Ahrefs Group Buy Boost Your SEO Strategy Group,"If you’re in the market for affordable group buy tools, SEORDP is the place to go. Not only does this website offer some of the best deals on group buy"
https://seordp.net/group-buy-seo-tools-affordable-access-to-premium-features,Group Buy SEO Tools Affordable Access To Premium Features,"What is SEO group buy? Get affordable access to premium SEO tools like Ahrefs, SEMrush, Moz at low cost. Get started at seordp.net."
https://seordp.net/the-ultimate-guide-to-seo-tools-group-buy-save-big-on-premium-seo-tools,The Ultimate Guide To SEO Tools Group Buy Save Big On,"Looking for cheap group buy tools? Look no further than Frase.io! Their tools make it easy to create and manage your groups, with features like automatic Get star..."
https://seordp.net/ai-content-labs,AI Content Labs Group Buy – AI Writer & Research Suite | SEORDP,"Welcome to Best Group Buy Seo Tools - The best place to buy SEO tools at affordable prices. We provide access to 35+ SEO tools including Copymatic, Moz, Get start..."
https://seordp.net/writer-plan,Writer Plan Group Buy – Content & SEO Pack | SEORDP,"SEORDP is the best group buy SEO tools provider in 2025, and it offers 60+ SEO Tools like Ahrefs, SEMrush cheaper than other group buy providers"
https://seordp.net/lite-plan,Lite Plan Group Buy – Best Price | SEORDP,"Learn about Claude Code, agentic coding tool that works in your terminal, IDE, desktop app, and browser to help you turn ideas into code faster Get started at seo..."
https://seordp.net/mega-plan,Mega Plan Group Buy – Affordable Pro Access | SEORDP,"Mega Plan group buy: access 80+ premium SEO tools at seordp.net. Ahrefs, SEMrush, Moz Pro and more at affordable price."
https://seordp.net/ahrefs-combo,Ahrefs Combo Group Buy – Shared & Private Plans | SEORDP,"Ahrefs Combo group buy: 50 daily credits, shared and private plans. Get Ahrefs at low cost at seordp.net."
https://seordp.net/small-plan,Small Plan Group Buy – Full Access | SEORDP,"hailuo ai Group Buy | Unlimited Download, Get it on Very Cheap Prices, No limit hailuo ai Group Buy, hailuo ai Group Buy | SEORDP Premium"
https://seordp.net/heygen,Heygen Group Buy – Cheap Premium Access | SEORDP,"seranking group buy, seranking at cheap price, seranking unlimited plan, seranking Get started at seordp.net."
https://seordp.net/helloscribe-ai,Helloscribe AI Group Buy – Cheap Helloscribe AI Access,"Sora ai Group Buy, Unlimited plan available at cheap price, Sora ai unlimited plan, Sora ai Group Buy, Sora ai at cheap price, Sora ai Pro plan Get started at seo..."
https://seordp.net/helloscribe-ai-group-buy,Helloscribe AI Group Buy | Group Buy SEO Tools,Helloscribe AI group buy: cheap access for AI writing and scripts. Trial and monthly plans. Get started at seordp.net.
https://seordp.net/glorify,Glorify Group Buy – Pro Access at Low Cost,"👉 Vyond Group Buy: Unlimited Access at an Cheap Price! 🔥Get Vyond group buy at very cheap price, Vyond Group Buy Video Animation Softwar Get started at seordp.net."
https://seordp.net/hashtagforlikes,Hashtagforlikes Group Buy – Unlimited Access at Best Price,"Heygen ai Group Buy, Generate unlimited video both creaitor and team plan available, heygen at cheap price, heygen group buy, Heygen Get started at seordp.net."
https://seordp.net/harpa-ai,Harpa AI Group Buy – $4.95/Month | SEORDP,"Talk with Claude, an AI assistant from Anthropic. Claude ai Premium plan, Claude AI Copywriting tool - Group buy at Cheap Price Get started at seordp.net."
https://seordp.net/growthbarseo,Growthbarseo Group Buy – Full Access | seordp,Growthbarseo group buy: unlimited plan for SEO chrome extension. Full access at best price. Get started at seordp.net.
https://seordp.net/pipppiads,Pipppiads Group Buy – Best Price Premium Access,"ChatGPT Plus Group buy | Unlimited Access | ChatGPT Plus Group buy, ChatGPT is an artificial intelligence chatbot, ChatGPT Premium Group buy Get started at seordp..."
https://seordp.net/graphic-stock,Graphic Stock Group Buy – Low Cost Pro Plan,"your content go beyond text with our realistic AI voices. Generate high-quality spoken audio in any voice, style, and language. Elevenlabs Group buy Get started a..."
https://seordp.net/gptzero-me,GPTZero.me Group Buy – $4.95/Month | SEORDP,Pictory Group Buy | Pictory uses AI to easily convert longform video and text content into short branded videos for social media Pictory ai Group Buy Get started ...
https://seordp.net/gorails,Gorails Group Buy – Save on Premium Tools,"Group buy SEO tools share 50+ quality best SEO Tools: Ai Tools, Ahrefs, SEMrush with the cheapest, Best Group buy tools Provider, SEORDP"
https://seordp.net/vyond,Vyond Group Buy – Instant Access at Low Price,"Capcut group buy is an all-in-one video editor and graphic design tool powered by AI, designed to simplify the video creation process. Get started at seordp.net."
https://seordp.net/glorify-group-buy-review,Glorify Group Buy Review Group Buy – 99% Uptime | seordp,"Writesonic AI Copywriting tool - Group buy at Cheap Price, Writesonic ai Group Buy, Truely Unlimited Plan, All Option Unlimited credit, 99% uptime Get started at ..."
https://seordp.net/getwsodo,Getwsodo Group Buy – Pro Plan at Best Price,"🎨 Get Leonardo AI Group Buy Maestro Unlimited Plan for Only $5, Leonardo AI is a feature-packed generative AI tool for creating AI art. Get started at seordp.net."
https://seordp.net/get-stencil,Get Stencil Group Buy – Premium Access Cheap,Adobe Stock Group Buy: Enjoy Unlimited Downloads. Adobe Creative Cloud Group Buy: Buy for just $3/month. Download unlimited premium assets Get started at seordp.net.
https://seordp.net/freshdrop,Freshdrop Group Buy – Group Buy at Low Cost,Freshdrop group buy: Lovo AI Studio Team Plan and dropshipping tools at low cost. Get started at seordp.net.
https://seordp.net/frase-io,Frase.io Group Buy – AI Writing & SEO Research at Low Cost | SEORDP,"Play.ht Group Buy For All Feature | Play.ht group buy at very cheap price Unlimited plan, Pro unlimited Characters, voice cloning, very cheap price Get started at..."
https://seordp.net/frase-io-group-buy,Frase.io Group Buy – AI Writing & SEO Research at Low Cost | SEORDP,Frase.io group buy: AI writing and SEO research at low cost. Get started at seordp.net.
https://seordp.net/fotor,Fotor Group Buy – Best Price Access | Group Buy SEO Tools,"Use Surfer to research, audit, write, optimize and generate SEO optimized articles in 20 minutes. ,SurferSeo Group buy at Cheap Prices. SurferSeo Get started at s..."
https://seordp.net/fotojet,Fotojet Group Buy – Low Price Premium | Group Buy SEO Tools,"Create professional voice overs with the leading enterprise-grade AI Voice Generator. Wellsaidlabs Group Buy, wellsaid labs group buy at cheap Get started at seor..."
https://seordp.net/fomoclips,Fomoclips Group Buy – Shared Account Cheap,Make videos easily by giving a prompt to Invideo AI. Invideo AI group buy. Ai plans full details at cheap prices. invideo group buy Get started at seordp.net.
https://seordp.net/flexclip,Flexclip Group Buy – Unlimited Pro Access,"Copymatic ai Group buy, Copymatic is a powerful AI-powered copywriter tools, Copymatic Group buy, Copymatic Group buy on SEORDP"
https://seordp.net/flaticon,Flaticon Group Buy – Premium at Low Price,"SurgeGraph group buy is your one-stop solution for SEO and AI Writing. With Longform AI, generate long-form content in minutes and grow your traffic, fast. Get st..."
https://seordp.net/findniche,Findniche Group Buy – Cheap Premium Access,SEMrush Group Buy is a tool that analyzes all indicators of a popular website - Price is 1$/month for Guru-Unlimited. SEMrush Group Buy. 😀 Get started at seordp.net.
https://seordp.net/exploding-topics,Exploding Topics Group Buy – Pro at Low Cost | SEORDP,"WordAi Unlimited tool Rewrite & ai Detection - Group buy Cheap Price, Word ai Group buy, best group buy seo tools , Unlimited wordai all option Get started at seo..."
https://seordp.net/everbee-io,Everbee IO Group Buy – Etsy Tools at Low Cost | SEORDP,"Envato Elements Group Buy | Unlimited Download, Get it on Very Cheap Prices, No limit Envato Group Buy, Envato Elements Group Buy | SEORDP"
https://seordp.net/everand,Everand Group Buy – Affordable Pro Access,"Freepik Group buy is a search engine that gives web designers and graphics access to image files, vectors, illustrations and PSD files for creative ... Get starte..."
https://seordp.net/elevenlabs-io,Elevenlabs.io Group Buy – Low Price | SEORDP,"Jasper Ai Group Buy or Jarvis ai group buy helps Instantly generate high-quality copy for ads, emails, websites, listings, blogs, & more. SEORDP"
https://seordp.net/educative,Educative Group Buy – Premium Plan Cheap,"frase.io Group buy | Unlimited Access | Frase Group buy, artificial intelligence and natural language processing Best ai, Frase Team Plan Group buy Get started at..."
https://seordp.net/dropship,Dropship Group Buy – Save Big on Pro Tools,"texta.ai Group Buy is a content writing tool that helps freelance writers, write better and faster. Texta.ai Group Buy With Unlimitted words just 3$ Get started a..."
https://seordp.net/dropispy,Dropispy Group Buy – Instant Pro Access | Group Buy SEO,"Pngtree is the best place to find free high-quality Png images, Backgrounds and Vector files. Pngtree group buy just $1 / month Pngtree Group buy Get started at s..."
https://seordp.net/dreamart-image-ai,DreamArt Image AI Group Buy – $4.95/Mo | SEORDP,Kapwing Group Buy Best Video editor - Price is 1$/month for Pro-Unlimited. Kapwing Group buy. 😀 Kapwing PRO Group Buy Get started at seordp.net.
https://seordp.net/doodly,Doodly Group Buy – Full Features Cheap | Group Buy SEO Tools,"Ahrefs group buy is a service by cheap SEO tools websites. Ahrefs Group Buy, Do you want to buy Ahrefs Group Buy SEO Tools, #Free SEMrush Get started at seordp.net."
https://seordp.net/domcop,Domcop Group Buy – Pro Access | seordp | Group Buy SEO Tools,Domcop group buy - access domain and SEO tools at low cost. Get instant access with group buy at seordp.net.
https://seordp.net/dezygn,Dezygn Group Buy – Unlimited at Low Price,Dezygn group buy - design and creative tools at affordable price. Get instant access at seordp.net.
https://seordp.net/designs-ai,Designs.ai Group Buy – $4.95/Month | SEORDP,Designs AI group buy - AI-powered design tools at low cost. Get instant access at seordp.net.
https://seordp.net/designbeast-app-group-buy-with-4-95-per-month,Designbeast App Group Buy With 4 95 Per Month Group Buy –,"Copy AI Group Buy is a content writing tool that helps freelance writers, marketing teams, and social media experts write better and faster. Get started at seordp..."
https://seordp.net/descript-tools,Descript Tools Group Buy – $4.95/Mo | SEORDP,"Quetext group buy, Unlimited Plagiarism Checker Group buy, Scan millions of websites and documents in seconds, Group buy Provider SEORDP"
https://seordp.net/deepl,Deepl Group Buy – Best Price Low Cost | Group Buy SEO Tools,DeepL group buy - premium translation tool at affordable price. Get instant access at seordp.net.
https://seordp.net/deepflush,Deepflush Group Buy – Save on Premium Tools | SEORDP,"Storyblocks Group Buy | Unlimited Download, Get it on Very Cheap Prices, No limit Storyblocks Group Buy, Storyblocks GroupBuy | SEORDP"
https://seordp.net/deepbrid,Deepbrid Group Buy – Best Price | SEORDP,Rytr.me Group Buy | Unlimited Access | Rytr Group buy 3$ / month || Rytr.me's unlimited group buy! Rytr.me Unlimited Group buy | Rytr Group buy Get started at seo...
https://seordp.net/crunchyroll,Crunchyroll Group Buy – Affordable Pro Access | SEORDP,"Get Wordtune group buy at low price 1$ per month. ... in purchasing a discount wordtune group buy, please visit the following link: SEORDP."
https://seordp.net/crunchbase,Crunchbase Group Buy – Business Data at Low Cost | SEORDP,Crunchbase group buy - access business and company data at low cost. Get instant access at seordp.net.
https://seordp.net/creativefearica,Creativefearica Group Buy – Full Access | SEORDP,Creativefearica group buy: full access to creative and design tools at affordable price. Get started at seordp.net.
https://seordp.net/creator-ai,Creator AI Group Buy – Cheap Premium Access | SEORDP,Creator AI group buy: AI content and copywriting tools at low cost. Get instant access at SEORDP.
https://seordp.net/crazy-egg,Crazy Egg Group Buy – Save on Premium Tools | SEORDP,Crazy Egg group buy: heatmaps and conversion optimization at best price. Get started at seordp.net.
https://seordp.net/copyscape,Copyscape Group Buy – Best Price | SEORDP,Copyscape group buy: plagiarism checker and content protection at best price. Get started at seordp.net.
https://seordp.net/copygenius,Copygenius Group Buy – Affordable Pro Access | SEORDP,"Discover the best group buy SEO tools providers in 2026. Compare top group buy sites like SEORDP & SEOShope. Save 95% on Ahrefs, SEMrush, Moz Pro & 50+ premium to..."
https://seordp.net/affiliate-marketing,Affiliate Marketing Group Buy – at Low Price | SEORDP,"Buy Ahrefs Group Buy at â¹1899/month ($15). Get Site Explorer, Keywords Explorer, Content Explorer & Competitive Analysis. 50 daily credits, 99% uptime! Get star..."
https://seordp.net/adsparo,Adsparo Group Buy – Full Access | SEORDP,"Get SEMrush Group Buy access at just $3/month. Use powerful Group Buy SEO Tools for keyword research, competitor analysis & site audits with instant access. Get s..."
https://seordp.net/adsector,Adsector Group Buy – Cheap Premium Access | SEORDP,"Get SEMrush Group Buy, Ahrefs Group Buy & 100+ premium SEO tools from just $5/mo. SEORDP delivers 99% uptime, instant access & 24/7 support."
https://seordp.net/adobe,Adobe Group Buy – Creative Cloud & Stock | SEORDP,"Adobe group buy: Creative Cloud, Stock and premium design tools at low cost. Get started at seordp.net."
https://seordp.net/adbeat,Adbeat Group Buy – Best Price | SEORDP,"Contact us only for general questions regarding the tools, and reporting technical problems. Get started at seordp.net."
https://seordp.net/ad-ecommerce,Ad Ecommerce Group Buy – Affordable Pro Access | SEORDP,"Group buy seo tools provides includes Ahrefs, SEMrush with the cheapest price per month. #1 SEO Group buy service in market Get started at seordp.net."
https://seordp.net/acoya,Acoya Group Buy – at Low Price | SEORDP,Acoya group buy - SEO and marketing tools at affordable price. Get instant access at seordp.net.
https://seordp.net/abacus,Abacus Group Buy – Premium Pro Access | Group Buy SEO Tools,Abacus group buy - AI writing tool at low cost. Get instant access at seordp.net.
https://seordp.net/123rf,123rf Group Buy – Low Cost Full Access | Group Buy SEO Tools,123rf group buy: stock photos and vectors at low cost. Full access at best price. Get started at seordp.net.
https://seordp.net/ad-adult,Ad Adult Group Buy – Affordable Full Access,"We made the entire site available to inexperienced bloggers, marketers, designers, and developers who couldn't afford premium tools. We are always dedicated Get s..."
https://seordp.net/prime-video,Prime Video Group Buy – Pro at Best Price,An Affiliate Program is a type of marketing program where a company gives commission or rewards to affiliates for each visitor or customer brought by the Get star...
https://seordp.net/invideo-ai,Invideo AI Group Buy – Full Access Cheap,Account credentials are never shared. We distribute access in a number of ways. The accounts' owner is informed of the entire procedure. We help bloggers in Get s...
https://seordp.net/picsart-pro,Picsart PRO Group Buy – Premium Best Price,Picsart Pro group buy - photo editing and design at affordable price. Get instant access at seordp.net.
https://seordp.net/capcut-pro,Capcut PRO Group Buy – Cheap Pro Access | Group Buy SEO,CapCut Pro group buy - video editor and design tool at low cost. Get instant access at seordp.net.
https://seordp.net/writesonic,Writesonic Group Buy – Low Price Pro Plan,Writesonic group buy - AI writing and copywriting at affordable price. Get instant access at seordp.net.
https://seordp.net/writerzen,Writerzen Group Buy – Unlimited Premium Access,"Unlock the power of RunwayML Pro with our shared group buy access â get all the premium features like AI Text-to-Video, Green Screen AI, Background Removal, and..."
https://seordp.net/smartcopy,Smartcopy Group Buy – Best Value Access | Group Buy SEO,Get Spin Rewriter group buy at low price 1$ per month. Get Instant Access. Spin Rewriter group buy. Best group buy website Get started at seordp.net.
https://seordp.net/spin-rewriter-ai,Spin Rewriter AI Group Buy – Pro Access Cheap,Get Article forge group buy at low price 6$ per month. Get Instant Access. Articleforge group buy Get started at seordp.net.
https://seordp.net/hix-ai,Hix AI Group Buy – Full Pro Plan | Group Buy SEO Tools,Article forge is the best tool for generating content and if you are looking to buy article forge with group buy this is the right place for you. Get started at s...
https://seordp.net/claude-ai,Claude AI Group Buy – Premium Access | seordp,Get Rytr group buy at low price 6$ per month. Get Instant Access. Rytr group buy. Best group buy website Get started at seordp.net.
https://seordp.net/you-com,You Com Group Buy – Low Cost Premium | Group Buy SEO Tools,Get Vyond group buy at low price 3$ per month. Get Instant Access. Vyond group buy. Best group buy website Get started at seordp.net.
https://seordp.net/quetext,Quetext Group Buy – Cheap Pro Plan | Group Buy SEO Tools,"Join our ChatGPT Group Buy service and get access to ChatGPT Plus and other premium AI & SEO tools at a fraction of the cost. Save up to 80% with our secure, reli..."
https://seordp.net/seositecheckup,Seositecheckup Group Buy – Best Price Pro Access,Get Frase.io Unlimited with SEO Added at low price 5$ per month. Frase unlimited with seo addon group buy Get started at seordp.net.
https://seordp.net/seoptimer,Seoptimer Group Buy – Affordable Pro Access | SEORDP,Udemy unlimited business account buy at cheap price just for 4$ per month. Watch unlimited content on Udemy at affordable cost. Get started at seordp.net.
https://seordp.net/woorank,Woorank Group Buy – at Best Price | SEORDP,Get SpamZilla group buy at low price 3$ per month. Get Instant Access. SpamZilla group buy. Best group buy website Get started at seordp.net.
